{
  "schema_version": 1,
  "case_id": "docx-novel-001",
  "task": "manuscript-preparation",
  "instructions": "Prepare the complete designated Chinese manuscript. Combine cover information, dedication, and table of contents into one leading front_matter Markdown unit, keeping cover fields and TOC entries as separate paragraphs without inventing a front-matter heading. Represent tab alignment by a single space and retain original displayed TOC page numbers. Convert actual chapter headings to level-one Markdown headings. Keep the full source heading as the unit title and preserve the original chapter-number string separately. Treat the epilogue as a narrative chapter and the appendix and afterword as back_matter. Render each ChineseDiary and ChineseQuote paragraph as its own blockquote block. Ignore empty layout-only paragraphs, but report uncertain scene-break treatment rather than silently resolving it. Resolve Word Choice/Fallback alternatives once. Leave unknown edition metadata unset and all downstream workflows not_started.",
  "input_location": "../../../fixtures/manuscripts/novel-sample",
  "recursive": false,
  "sources": [
    {
      "source_id": "novel-docx",
      "file": "遗落梦境与记忆尽头.docx",
      "sha256": "c2c13eaf5110ea7e68a41893b91c762151bab5e926e6cc316087b3dc99aa9a26"
    }
  ],
  "reference_file": "reference-map.json",
  "ground_truth_file": "ground-truth.json",
  "ground_truth_sha256": "5471de5080d48ed0c7094b5d2c33156d4750f2ffd042ee2fc272fe2f98c5221d",
  "expected_metadata": {
    "title": "遗落梦境与记忆尽头",
    "authors": ["萧林"],
    "source_language": "zh",
    "work_type": "fiction",
    "edition": null
  },
  "expected_preparation_status": "ready",
  "expected_workflows": {
    "literary-editing": {"status": "not_started"},
    "literary-translation": {"status": "not_started"},
    "literary-agent-querying": {"status": "not_started"},
    "format-manuscript": {"status": "not_started"}
  },
  "scope_kind": "whole_work",
  "require_trace": true,
  "manual_checks": [
    "cover-and-toc-preservation",
    "diary-quotation-and-inline-formatting",
    "scene-break-treatment"
  ]
}
